,text,type
3267,Jesus answered and said to him: What I do thou knowest not now; but thou shalt know hereafter. ,selected_bible_verses
3268,"Peter says to him: Never shalt thou wash my feet. Jesus answered him: If I wash thee not, thou hast no part with me. ",selected_bible_verses
3269,"Simon Peter says to him: Lord, not my feet only, but also my hands and my head. ",selected_bible_verses
3270,"Jesus says to him: He that has bathed has no need save to wash the feet, but is wholly clean. And ye are clean; but not all. ",selected_bible_verses
3271,For he knew his betrayer; therefore he said: Ye are not all clean.  ,selected_bible_verses
3272,"When therefore he had washed their feet, he took his garments, and reclining again at table, said to them: Know ye what I have done to you? ",selected_bible_verses
3273,"Ye call me the Teacher, and the Master; and ye say well, for so I am. ",selected_bible_verses
3274,"If I then, the Master and the Teacher, washed your feet, ye also ought to wash one another's feet. ",selected_bible_verses
3275,"For I gave you an example, that as I did to you, ye also should do. ",selected_bible_verses
3276,"If ye know these things, happy are ye if ye do them.  ",selected_bible_verses
3277,"I speak not of you all; I know whom I chose; but that the scripture might be fulfilled, He that eats the loaf with me lifted up his heel against me. ",selected_bible_verses
3278,"Even now I tell you, before it comes to pass, that when it comes to pass, ye may believe that I am he. ",selected_bible_verses
3279,"Verily, verily, I say to you, he that receives whomsoever I send receives me; and he that receives me receives him who sent me.  ",selected_bible_verses
3280,"Having said this, Jesus was troubled in spirit, and testified and said: Verily, verily, I say to you, that one of you will betray me. ",selected_bible_verses
3281,"The disciples therefore looked one on another, doubting of whom he spoke. ",selected_bible_verses
3282,"And there was reclining in Jesus' bosom one of his disciples, whom Jesus loved. ",selected_bible_verses
3283,"To him therefore Simon Peter beckons, and says to him: Say who it is of whom he speaks. ",selected_bible_verses
3284,"And he, leaning back on Jesus' breast, says to him: Lord, who is it? ",selected_bible_verses
3285,"Jesus answers: He it is, to whom I shall give the morsel, when I have dipped it. And having dipped the morsel, he gives it to Judas Iscariot, son of Simon. ",selected_bible_verses
3286,"And after the morsel, then entered Satan into him. Jesus therefore says to him: What thou doest, do quickly.  ",selected_bible_verses
3287,And no one at the table knew for what intent he spoke this to him. ,selected_bible_verses
3288,"For some thought, because Judas had the bag, that Jesus said to him: Buy what we need for the feast; or, that he should give something to the poor.  ",selected_bible_verses
3289,"He then, having received the morsel, went immediately out; and it was night.  ",selected_bible_verses
3290,"When therefore he was gone out, Jesus says: Now is the Son of man glorified, and God is glorified in him. ",selected_bible_verses
3291,"If God is glorified in him, God will also glorify him in himself, and will straightway glorify him. ",selected_bible_verses
3292,"Children, yet a little while I am with you. Ye will seek me; and as I said to the Jews, whither I go ye can not come, so now I say to you. ",selected_bible_verses
3293,"A new commandment I give to you, that ye love one another; as I loved you, that ye also love one another. ",selected_bible_verses
3294,"By this shall all know that ye are my disciples, if ye have love one toward another.  ",selected_bible_verses
3295,"Simon Peter says to him: Lord, whither goest thou? Jesus answered him: Whither I go, thou canst not follow me now; but thou shalt follow me afterward. ",selected_bible_verses
3296,"Peter says to him: Lord, why can not I follow thee now? I will lay down my life for thee. ",selected_bible_verses
3297,"In my Father's house are many mansions; if it were not so, I would have told you; because I go to prepare a place for you. ",selected_bible_verses
3298,"And if I go and prepare a place for you, I will come again, and will receive you to myself; that where I am ye may be also. ",selected_bible_verses
3299,And ye know the way whither I go.  ,selected_bible_verses
3300,"Thomas says to him: Lord, we know not whither thou goest; and how do we know the way? ",selected_bible_verses
3301,"Jesus says to him: I am the way, the truth, and the life. No one comes to the Father, but by me. ",selected_bible_verses
3302,"If ye knew me, ye would know my Father also; and from henceforth ye know him, and have seen him.  ",selected_bible_verses
3303,"Philip says to him: Lord, show us the Father, and it suffices us. ",selected_bible_verses
3304,"Jesus says to him: Am I so long time with you, and dost thou not know me, Philip? He that has seen me has seen the Father; and how sayest thou: Show us the Father? ",selected_bible_verses
3305,"Believest thou not that I am in the Father, and the Father in me? The words that I speak to you I speak not of myself; but the Father who dwells in me, he does the works. ",selected_bible_verses
3306,"Believe me, that I am in the Father, and the Father in me; or else believe for the very works' sake.  ",selected_bible_verses
3307,"Verily, verily, I say to you, he that believes on me, the works that I do he shall do also, and greater than these shall he do, because I go to the Father. ",selected_bible_verses
3308,"And whatever ye shall ask in my name, that I will do, that the Father may be glorified in the Son. ",selected_bible_verses
3309,"If ye shall ask anything in my name, I will do it.  ",selected_bible_verses
3310,"If ye love me, keep my commandments. ",selected_bible_verses
3311,"And I will ask of the Father, and he will give you another Comforter, that he may be with you forever; ",selected_bible_verses
3312,"the Spirit of truth, whom the world can not receive, because it sees him not, neither knows him; but ye know him, because he abides with you, and shall be in you. ",selected_bible_verses
3313,"Yet a little while, and the world sees me no more; but ye see me; because I live, ye shall live also. ",selected_bible_verses
3314,"In that day ye shall know that I am in my Father, and ye in me, and I in you. ",selected_bible_verses
3315,"He that has my commandments, and keeps them, he it is that loves me; and he that loves me shall be loved by my Father, and I will love him, and will manifest myself to him.  ",selected_bible_verses
3316,"Judas says to him (not Iscariot): Lord, how is it that thou wilt manifest thyself to us, and not to the world? ",selected_bible_verses
3317,"Jesus answered and said to him: If any one loves me, he will keep my word; and my Father will love him, and we will come to him, and make our abode with him. ",selected_bible_verses
3318,"He that loves me not, keeps not my words; and the word which ye hear is not mine, but the Father's who sent me.  ",selected_bible_verses
3319,"These things have I spoken to you, while abiding with you. ",selected_bible_verses
3320,"But the Comforter, the Holy Spirit, whom the Father will send in my name, he will teach you all things, and bring to your remembrance all things which I said to you.  ",selected_bible_verses
3321,"Peace I leave with you, my peace I give to you; not as the world gives, give I to you. Let not your heart be troubled, neither let it be afraid. ",selected_bible_verses
3322,"Ye heard how I said to you: I go away; and I come to you. If ye loved me, ye would have rejoiced that I go to the Father; because the Father is greater than I. ",selected_bible_verses
3323,"And now I have told you before it comes to pass, that, when it is come to pass, ye may believe.  ",selected_bible_verses
3324,"I will no longer talk much with you; for the prince of the world comes, and in me he has nothing. ",selected_bible_verses
3325,"But that the world may know that I love the Father, and as the Father gave me commandment, so I do. Arise, let us go hence.    XV.  I AM the true vine, and my Father is the husbandman. ",selected_bible_verses
3326,"Every branch in me that bears not fruit, he takes it away; and every one that bears fruit, he cleanses it, that it may bear more fruit. ",selected_bible_verses
3327,"Ye are already clean, through the word which I have spoken to you.  ",selected_bible_verses
3328,"Abide in me, and I in you. As the branch can not bear fruit of itself, if it abide not in the vine, so neither can ye, if ye abide not in me. ",selected_bible_verses
3329,"I am the vine, ye are the branches. He that abides in me and I in him, the same bears much fruit; because without me ye can do nothing. ",selected_bible_verses
3330,"If any one abide not in me, he is cast forth as the branch, and is withered; and they gather them, and cast them into the fire, and they are burned. ",selected_bible_verses
3331,"If ye abide in me, and my words abide in you, ask whatever ye will, and it shall be done to you.  ",selected_bible_verses
3332,"Herein is my Father glorified, that ye bear much fruit; and ye shall become my disciples. ",selected_bible_verses
3333,"As the Father loved me, I also loved you; abide in my love. ",selected_bible_verses
3334,"If ye keep my commandments, ye shall abide in my love; as I have kept my Father's commandments, and abide in his love.  ",selected_bible_verses
3335,"These things I have spoken to you, that my joy may be in you, and your joy be made full. ",selected_bible_verses
3336,"This is my commandment, that ye love one another, as I loved you. ",selected_bible_verses
3337,"Greater love has no one than this, that one lay down his life for his friends. ",selected_bible_verses
3338,"Ye are my friends, if ye do whatever I command you.  ",selected_bible_verses
3339,No longer do I call you servants; because the servant knows not what his lord does. But I have called you friends because all things that I heard from my Father I made known to you. ,selected_bible_verses
3340,"Ye did not choose me, but I chose you, and appointed you that ye may go and bear fruit, and that your fruit may remain; that whatever ye shall ask of the Father in my name, he may give it you.  ",selected_bible_verses
3341,"These things I command you, that ye love one another. ",selected_bible_verses
3342,"If the world hates you, ye know that it has hated me before it hated you. ",selected_bible_verses
3343,"If ye were of the world, the world would love its own; but because ye are not of the world, but I chose you out of the world, for this the world hates you. ",selected_bible_verses
3344,"Remember the word that I said to you: A servant is not greater than his lord. If they persecuted me, they will also persecute you; if they kept my saying, they will keep yours also. ",selected_bible_verses
3345,"But all these things they will do to you for my name's sake, because they know not him who sent me.  ",selected_bible_verses
3346,"If I had not come and spoken to them, they would not have sin; but now they have no cloak for their sin. ",selected_bible_verses
3347,He that hates me hates my Father also. ,selected_bible_verses
3348,"If I had not done among them the works which no other one has done, they would not have sin; but now they have both seen and hated both me and my Father. ",selected_bible_verses
3349,"But this comes to pass, that the word might be fulfilled that is written in their law: They hated me without a cause.  ",selected_bible_verses
3350,"But when the Comforter is come, whom I will send to you from the Father, the Spirit of truth, which proceeds from the Father, he will bear witness of me. ",selected_bible_verses
3351,"And ye also shall bear witness, because ye are with me from the beginning.    XVI.  THESE things I have spoken to you, that ye should not be offended. ",selected_bible_verses
3352,"They will put you out of the synagogues; yea, a time is coming, that every one who kills you will think he makes an offering to God. ",selected_bible_verses
3353,"And these things they will do to you, because they have not known the Father, nor me. ",selected_bible_verses
3354,"But these things I have spoken to you, that when the time shall come, ye may remember that I told you. And these things I told you not from the beginning, because I was with you.  ",selected_bible_verses
3355,And now I go to him who sent me; and none of you asks me: Whither goest thou? ,selected_bible_verses
3356,"But because I have spoken these things to you, sorrow has filled your heart. ",selected_bible_verses
3357,"But I tell you the truth, it is expedient for you that I depart; for if I depart not, the Comforter will not come to you; but if I go, I will send him to you. ",selected_bible_verses
3358,"And when he is come, he will convict the world, in respect of sin, and of righteousness, and of judgment; ",selected_bible_verses
3359,"of sin, in that they believe not on me; ",selected_bible_verses
3360,"of righteousness, in that I go to my Father, and ye behold me no more; ",selected_bible_verses
3361,"of judgment, in that the prince of this world has been judged.  ",selected_bible_verses
3362,"I have yet many things to say to you, but ye can not bear them now. ",selected_bible_verses
3363,"But when he, the Spirit of truth is come, he will guide you into all the truth; for he will not speak from himself, but whatever he shall hear, that will he speak, and he will tell you the things to come. ",selected_bible_verses
3364,"He will glorify me; because he will receive of mine, and will tell it to you. ",selected_bible_verses
3365,"All things that the Father has are mine. Therefore, I said, that he will receive of mine, and will tell it to you. ",selected_bible_verses
3366,"A little while, and ye behold me not; and again a little while, and ye shall see me.  ",selected_bible_verses
3367,"Therefore some of his disciples said to one another: What is this that he says to us, A little while, and ye behold me not; and again a little while, and ye shall see me; and, I go to the Father? ",selected_bible_verses
3368,"They said therefore: What is this that he says, A little while? We know not what he says.  ",selected_bible_verses
3369,"Jesus knew that they were desirous to ask him, and said to them: Do ye inquire of this with one another, that I said, A little while, and ye behold me not; and again a little while, and ye shall see me? ",selected_bible_verses
3370,"Verily, verily, I say to you, that ye will weep and lament, but the world will rejoice; and ye will be sorrowful, but your sorrow shall be turned into joy. ",selected_bible_verses
3371,"A woman when she is in travail has sorrow, because her hour is come; but when she has borne the child, she remembers no more the anguish, for joy that a man is born into the world. ",selected_bible_verses
3372,"And so ye now have sorrow; but I will see you again, and your heart shall rejoice, and your joy no one takes from you.  ",selected_bible_verses
3373,"And in that day ye shall ask nothing of me. Verily, verily, I say to you: Whatever ye shall ask of the Father, he will give it you in my name. ",selected_bible_verses
3374,"Hitherto ye asked nothing in my name. Ask, and ye shall receive, that your joy may be made full.  ",selected_bible_verses
3375,"These things I have spoken to you in parables. A time is coming, when I will no more speak to you in parables, but I will tell you plainly of the Father. ",selected_bible_verses
3376,"In that day ye shall ask in my name. And I say not to you, that I will pray the Father for you; ",selected_bible_verses
3377,"for the Father himself loves you, because ye have loved me, and have believed that I came forth from God. ",selected_bible_verses
3378,"I came forth from the Father, and have come into the world; again, I leave the world, and go to the Father.  ",selected_bible_verses
3379,"His disciples say to him: Lo, now thou speakest plainly, and speakest no parable. ",selected_bible_verses
3380,"Now we know that thou knowest all things, and needest not that any one should ask thee. By this we believe that thou camest forth from God.  ",selected_bible_verses
3381,Jesus answered them: Do ye now believe? ,selected_bible_verses
3382,"Behold, an hour is coming, and has come, that ye will be scattered, each one to his own, and will leave me alone; and I am not alone, because the Father is with me.  ",selected_bible_verses
3383,"These things I have spoken to you, that in me ye may have peace. In the world ye have tribulation; but be of good cheer, I have overcome the world.    XVII.  THESE words spoke Jesus, and lifted up his eyes to heaven, and said: Father, the hour has come; glorify thy Son, that thy Son may glorify thee; ",selected_bible_verses
3384,"as thou gayest him authority over all flesh, that as many as thou hast given to him, to them he should give eternal life. ",selected_bible_verses
3385,"And this is the eternal life, that they know thee the only true God, and Jesus Christ, whom thou didst send. ",selected_bible_verses
3386,I glorified thee on the earth; I finished the work which thou hast given me to do. ,selected_bible_verses
3387,"And now, O Father, glorify thou me with thine own self, with the glory which I had with thee before the world was. ",selected_bible_verses
3388,"I manifested thy name to the men whom thou hast given me out of the world. Thine they were, and thou hast given them to me; and they have kept thy word. ",selected_bible_verses
3389,Now they know that all things whatever thou hast given me are from thee; ,selected_bible_verses
3390,"because the words which thou gayest me I have given to them, and they received them, and knew in truth that I came forth from thee, and believed that thou didst send me. ",selected_bible_verses
3391,"I pray for them; I pray not for the world, but for those whom thou hast given me; because they are thine. ",selected_bible_verses
3392,"And all things that are mine are thine, and thine are mine; and I am glorified in them.  ",selected_bible_verses
3393,"And I am no longer in the world; and these are in the world, and I come to thee. Holy Father, keep those in thy name whom thou hast given me, that they may be one, as we are, ",selected_bible_verses
3394,"While I was with them, I kept them in thy name. Those whom thou hast given me I watched over and none of them perished, except the son of perdition, that the scripture might be fulfilled. ",selected_bible_verses
3395,"And now I come to thee; and these things I speak in the world, that they may have my joy made full in them. ",selected_bible_verses
3396,"I have given them thy word; and the world hated them, because they are not of the world, as I am not of the world. ",selected_bible_verses
3397,"I pray not that thou shouldest take them out of the world, but that thou shouldest keep them from the evil. ",selected_bible_verses
3398,"They are not of the world, as I am not of the world. ",selected_bible_verses
3399,Sanctify them in the truth; thy word is truth. ,selected_bible_verses
3400,"As thou didst send me into the world, I also sent them into the world. ",selected_bible_verses
3401,"And for their sakes I sanctify myself, that they also may be sanctified in the truth. ",selected_bible_verses
3402,"And I pray not for these only, but also for those who believe on me through their word; ",selected_bible_verses
3403,"that all may be one; as thou, Father, in me and I in thee, that they also may be in us; that the world may believe that thou didst send me. ",selected_bible_verses
3404,"And the glory which thou hast given to me I have given to them, that they may be one, as we are one; ",selected_bible_verses
3405,"I in them, and thou in me, that they may be perfected into one; that the world may know that thou didst send me, and lovedst them as thou lovedst me.  ",selected_bible_verses
3406,"Father, those whom thou hast given me, I will that where I am they also be with me; that they may behold my glory, which thou hast given me; because thou lovedst me before the foundation of the world. ",selected_bible_verses
3407,"Righteous Father! And the world knew thee not! But I knew thee, and these knew that thou didst send me; ",selected_bible_verses
3408,"and I made known to them thy name, and will make it known; that the love wherewith thou lovedst me may be in them, and I in them.    XVIII.  HAVING spoken these words, Jesus went out with his disciples beyond the brook Kedron, where was a garden, into which he entered and his disciples. ",selected_bible_verses
3409,"And Judas also, his betrayer knew the place; because Jesus ofttimes resorted thither with his disciples.  ",selected_bible_verses
3410,"Judas therefore, having received the band and officers from the chief priests and Pharisees, comes thither with torches and lamps and weapons. ",selected_bible_verses
3411,"Jesus therefore, knowing all the things that were coming upon him, went forth and said to them: Whom do ye seek? ",selected_bible_verses
3412,"They answered him: Jesus the Nazarene. Jesus says to them: I am he. And Judas also, his betrayer, was standing with them.  ",selected_bible_verses
3413,"When therefore he said to them, I am he, they went backward, and fell to the ground.  ",selected_bible_verses
3414,Again therefore he asked them: Whom do ye seek? And they said: Jesus the Nazarene. ,selected_bible_verses
3415,"Jesus answered: I told you that I am he; if therefore ye seek me, let these go their way; ",selected_bible_verses
3416,"that the saying might be fulfilled, which he spoke: Of those whom thou hast given me, I lost none.  ",selected_bible_verses
3417,"Then Simon Peter, having a sword, drew it and smote the servant of the high priest, and cut off his right ear. The servant's name was Malchus. ",selected_bible_verses
3418,"Jesus therefore said to Peter: Put up thy sword into the sheath. The cup which my Father has given me, shall I not drink it?  ",selected_bible_verses
3419,"So the band, and the captain, and the officers of the Jews, took Jesus and bound him, ",selected_bible_verses
3420,"and led him away to Annas first; for he was father-in-law of Caiaphas, who was high priest that year. ",selected_bible_verses
3421,"And it was Caiaphas who counseled the Jews, that it is expedient that one man should die for the people.  ",selected_bible_verses
3422,"And Simon Peter and the other disciple followed Jesus. That disciple was known to the high priest, and went in with Jesus into the court of the high priest. ",selected_bible_verses
3423,"But Peter was standing at the door without. Therefore the other disciple, who was known to the high priest, went out and spoke to her that kept the door, and brought in Peter. ",selected_bible_verses
3424,Then the damsel that kept the door says to Peter: Art not thou also one of this man's disciples? He says: I am not.  ,selected_bible_verses
3425,"And the servants and the officers were standing there, having made a fire of coals, because it was cold, and were warming themselves; and Peter was standing with them, and warming himself.  ",selected_bible_verses
3426,"The high priest therefore asked Jesus concerning his disciples, and concerning his teaching. ",selected_bible_verses
3427,"Jesus answered him: I have spoken openly to the world; I ever taught in the synagogue, and in the temple, where all the Jews assemble; and I spoke nothing in secret. ",selected_bible_verses
3428,"Why askest thou me? Ask those who have heard, what I spoke to them. Behold, these know what things I said.  ",selected_bible_verses
3429,"And when he had said this, one of the officers who was standing by gave Jesus a blow on the face, saying: Answerest thou the high priest so? ",selected_bible_verses
3430,"Jesus answered him: If I spoke evil, bear witness of the evil; but if well, why dost thou smite me?  ",selected_bible_verses
3431,Annas sent him bound to Caiaphas the high priest. ,selected_bible_verses
3432,"And Simon Peter was standing and warming himself. They said therefore to him: Art thou also one of his disciples? He denied, and said: I am not. ",selected_bible_verses
3433,"One of the servants of the high priest, being a kinsman of him whose ear Peter cut off, says: Did not I see thee in the garden with him? ",selected_bible_verses
3434,Again therefore Peter denied; and immediately a cock crowed.  ,selected_bible_verses
3435,"Then they lead Jesus from Caiaphas into the Governor's palace; and it was early; and they themselves went not into the palace, that they might not be defiled, but might eat the passover. ",selected_bible_verses
3436,"Pilate therefore went out to them, and said: What accusation do ye bring against this man? ",selected_bible_verses
3437,"They answered and said to him: If this man were not a malefactor, we would not have delivered him up to thee. ",selected_bible_verses
3438,"Pilate therefore said to them: Do ye take him, and judge him according to your law. The Jews therefore said to him: It is not lawful for us to put any one to death; ",selected_bible_verses
3439,"that the saying of Jesus might be fulfilled, which he spoke, signifying by what manner of death he should die.  ",selected_bible_verses
3440,"Pilate therefore entered into the palace again, and called Jesus, and said to him: Art thou the King of the Jews? ",selected_bible_verses
3441,"Jesus answered: Dost thou say this of thyself, or did others tell thee concerning me? ",selected_bible_verses
3442,"Pilate answered: Am I a Jew? Thine own nation, and the chief priests, delivered thee up to me. What didst thou? ",selected_bible_verses
3443,"Jesus answered: My kingdom is not of this world. If my kingdom were of this world, my servants would fight, that I might not be delivered up to the Jews; but now is my kingdom not from hence. ",selected_bible_verses
