,text,type
1625,And these signs shall accompany those who have believed; in my name they shall cast out demons; they shall speak with new tongues; ,selected_bible_verses
1626,"they shall take up serpents; and if they drink any deadly thing, it shall not hurt them, they shall lay hands on the sick, and they shall recover.  ",selected_bible_verses
1627,"The Lord therefore, after he had spoken to them, was taken up into heaven, and sat down on the right hand of God; ",selected_bible_verses
1628,"as they, who from the beginning were eyewitnesses and ministers of the word, delivered them to us; ",selected_bible_verses
1629,"it seemed good to me also, having accurately traced all from the very first, to write to thee in order, most excellent Theophilus; ",selected_bible_verses
1630,"There was in the days of Herod, the king of Judaea, a certain priest, Zachariah by name, of the course of Abijah; and his wife was of the daughters of Aaron, and her name was Elisabeth. ",selected_bible_verses
1631,"And they were both righteous before God, walking in all the commandments and ordinances of the Lord blameless. ",selected_bible_verses
1632,"And they had no child, because Elisabeth was barren; and they both were now far advanced in years.  ",selected_bible_verses
1633,"And it came to pass, that while he executed the priest's office before God, in the order of his course, ",selected_bible_verses
1634,"it fell to his lot, according to the custom of the priest's office, to burn incense, going into the temple of the Lord. ",selected_bible_verses
1635,"And the whole multitude of the people were praying without, at the hour of incense. ",selected_bible_verses
1636,"And there appeared to him an angel of the Lord, standing on the right side of the altar of incense. ",selected_bible_verses
1637,"And Zachariah seeing him was troubled, and fear fell upon him. ",selected_bible_verses
1638,"But the angel said to him: Fear not, Zachariah; for thy prayer was heard, and thy wife Elisabeth shall bear thee a son, and thou shalt call his name John. ",selected_bible_verses
1639,And thou shalt have joy and gladness; and many shall rejoice at his birth. ,selected_bible_verses
1640,"For he shall be great before the Lord; and he shall not drink wine nor strong drink; and he shall be filled with the Holy Spirit, even from his mother's womb. ",selected_bible_verses
1641,And many of the sons of Israel shall he turn to the Lord their God. ,selected_bible_verses
1642,"And he shall go before him in the spirit and power of Elijah, to turn the hearts of the fathers to the children, and the disobedient to the wisdom of the just; to make ready a prepared people for the Lord.  ",selected_bible_verses
1643,"And Zachariah said to the angel: Whereby shall I know this? For I am an old man, and my wife is far advanced in years. ",selected_bible_verses
1644,"And the angel answering said to him: I am Gabriel, that stands in the presence of God; and I was sent to speak to thee, and to bring thee these glad tidings. ",selected_bible_verses
1645,"And, behold, thou shalt be dumb, and not able to speak, until the day that these things shall be performed, because thou didst not believe thy words, which shall be fulfilled in their season.  ",selected_bible_verses
1646,And the people were waiting for Zachariah; and they were wondering at his long tarrying in the temple. ,selected_bible_verses
1647,"And when he came out he was not able to speak to them, and they perceived that he had seen a vision in the temple; and he was making signs to them, and remained speechless.  ",selected_bible_verses
1648,"And it came to pass, when the days of his ministration were completed, that he departed to his own house.  ",selected_bible_verses
1649,"And after those days his wife Elisabeth conceived; and she hid herself five months, saying: ",selected_bible_verses
1650,"Thus has the Lord dealt with me, in the days wherein he looked on me to take away my reproach among men.  ",selected_bible_verses
1651,"And in the sixth month the angel Gabriel was sent from God to a city of Galilee, named Nazareth, ",selected_bible_verses
1652,"to a virgin betrothed to a man whose name was Joseph, of the house of David; and the virgin's name was Mary. ",selected_bible_verses
1653,"And the angel coming in to her, said: Hail, highly favored! The Lord is with thee. Blessed art thou among women. ",selected_bible_verses
1654,And she was troubled at the saying; and was considering what manner of salutation this might be. ,selected_bible_verses
1655,"And the angel said to her: Fear not, Mary; for thou didst find favor with God. ",selected_bible_verses
1656,"And, behold, thou shalt conceive in thy womb, and bring forth a son, and shalt call his name Jesus. ",selected_bible_verses
1657,"He shall be great, and shall be called Son of the Highest; and the Lord God will give to him the throne of David his father; ",selected_bible_verses
1658,and he shall reign over the house of Jacob forever; and of his kingdom there shall be no end.  ,selected_bible_verses
1659,"Then said Mary to the angel: How shall this be, seeing that I know not a man? ",selected_bible_verses
1660,"And the angel answering said to her: The Holy Spirit will come upon thee, and the power of the Highest will overshadow thee; therefore also the Holy One that is born shall be called the Son of God. ",selected_bible_verses
1661,"And, behold, Elisabeth thy kinswoman, she also has conceived a son in her old age; and this is the sixth month with her who is called barren. ",selected_bible_verses
1662,And Mary said: Behold the handmaid of the Lord; let it be to me according to thy word. And the angel departed from her.  ,selected_bible_verses
1663,"And Mary arose in those days, and went into the hill-country with haste, into a city of Judah; ",selected_bible_verses
1664,"and entered into the house of Zachariah, and saluted Elisabeth. ",selected_bible_verses
1665,"And it came to pass, as Elisabeth heard the salutation of Mary, that the babe leaped in her womb; and Elisabeth was filled with the Holy Spirit. ",selected_bible_verses
1666,"And she spoke out with a loud voice and said: Blessed art thou among women, and blessed is the fruit of thy womb. ",selected_bible_verses
1667,"And whence is this to me, that the mother of my Lord should come to me? ",selected_bible_verses
1668,"For, behold, as the voice of thy salutation came into my ears, the babe leaped in my womb for joy. ",selected_bible_verses
1669,And Mary said: My soul magnifies the Lord; ,selected_bible_verses
1670,and my spirit rejoiced in God my Savior. ,selected_bible_verses
1671,"Because he looked upon the low estate of his handmaid; for, behold, henceforth all generations will call me happy. ",selected_bible_verses
1672,Because the Mighty One did great things for me; and holy is his name. ,selected_bible_verses
1673,"And his mercy is from generation to generation, to those who fear him. ",selected_bible_verses
1674,He wrought might with his arm; he scattered the proud in the imagination of their hearts. ,selected_bible_verses
1675,"He cast down princes from thrones, and exalted those of low degree. ",selected_bible_verses
1676,"The hungry he filled with good, and the rich he sent empty away. ",selected_bible_verses
1677,"He helped Israel, his servant; to remember mercy, ",selected_bible_verses
1678,"as he spoke to our fathers, for Abraham and for his seed forever.  ",selected_bible_verses
1679,"And Mary abode with her about three months, and returned to her own house.  ",selected_bible_verses
1680,Now Elisabeth's full time came that she should be delivered; and she brought forth a son. ,selected_bible_verses
1681,And her neighbors and her kindred heard that the Lord showed great mercy toward her; and they rejoiced with her.  ,selected_bible_verses
1682,"And it came to pass, that on the eighth day they came to circumcise the child; and they called him Zachariah, after the name of his father. ",selected_bible_verses
1683,And his mother answered and said: Nay; but he shall be called John. ,selected_bible_verses
1684,And they said to her: There is none of thy kindred that is called by this name. ,selected_bible_verses
1685,"And they made signs to his father, how he would have him called. ",selected_bible_verses
1686,"And asking for a writing-tablet, he wrote, saying: His name is John. And they all wondered. ",selected_bible_verses
1687,"And his mouth was opened immediately, and his tongue was loosed; and he spoke, blessing God. ",selected_bible_verses
1688,"And all who heard laid them up in their hearts, saying: What then will this child be! And the hand of the Lord was with him.  ",selected_bible_verses
1689,"And Zachariah his father was filled with the Holy Spirit, and prophesied, saying: ",selected_bible_verses
1690,"Blessed be the Lord, the God of Israel, that he visited and wrought redemption for his people; ",selected_bible_verses
1691,"and raised up a horn of salvation for us, in the house of David his servant, ",selected_bible_verses
1692,"(as he spoke by the mouth of his holy prophets of old,) ",selected_bible_verses
1693,"salvation from our enemies, and from the hand of all that hate us; ",selected_bible_verses
1694,"to show mercy to our fathers, and to remember his holy covenant; ",selected_bible_verses
1695,"the oath which he swore to Abraham our father, ",selected_bible_verses
1696,"to grant to us, that without fear, being rescued from the hand of our enemies, we should serve him, ",selected_bible_verses
1697,in holiness and righteousness before him all our days.  ,selected_bible_verses
1698,"And also thou, O child, shalt be called Prophet of the Highest; for thou shalt go before the face of the Lord, to prepare his ways, ",selected_bible_verses
1699,in order to give knowledge of salvation to his people in remission of their sins; ,selected_bible_verses
1700,"through the tender mercies of our God, whereby the dayspring from on high visited us, ",selected_bible_verses
1701,"to give light to those sitting in darkness and the shadow of death, in order to guide our feet into the way of peace.  ",selected_bible_verses
1702,"And the child grew, and became strong in spirit, and was in the deserts till the day of his manifestation to Israel.    II.  AND it came to pass in those days, that there went out a decree from Caesar Augustus, that all the world should be registered. ",selected_bible_verses
1703,This registering was the first made when Cyrenius was governor of Syria. ,selected_bible_verses
1704,"And all went to be registered, each one to his own city. ",selected_bible_verses
1705,"And Joseph also went up from Galilee, out of the city of Nazareth, into Judaea, to the city of David which is called Bethlehem (because he was of the house and family of David), ",selected_bible_verses
1706,"to be registered with Mary his betrothed wife, who was with child. ",selected_bible_verses
1707,"And so it was, that, while they were there, the days were completed that she should bring forth. ",selected_bible_verses
1708,"And she brought forth her first-born son, and wrapped him in swathing bands, and laid him in a manger; because there was no room for them in the inn.  ",selected_bible_verses
1709,"And there were in the same country shepherds abiding in the field, and keeping watch over their flock by night. ",selected_bible_verses
1710,"And, behold, an angel of the Lord came upon them, and the glory of the Lord shone around them; and they were sore afraid. ",selected_bible_verses
1711,"And the angel said to them: Fear not; for, behold, I bring you good tidings of great joy, which shall be to all the people. ",selected_bible_verses
1712,"For to you is born this day in the city of David a Savior, who is Christ the Lord. ",selected_bible_verses
1713,"And this shall be to you the sign: Ye will find a babe wrapped in swathing bands, lying in a manger. ",selected_bible_verses
1714,"And suddenly there was with the angel a multitude of the heavenly host, praising God and saying: ",selected_bible_verses
1715,"Glory to God in the highest, and on earth peace, good will among men.  ",selected_bible_verses
1716,"And it came to pass, when the angels were gone away from them into heaven, that the shepherds said one to another: Let us go now unto Bethlehem, and see this thing that is come to pass, which the Lord made known to us. ",selected_bible_verses
1717,"And they came with haste, and found both Mary and Joseph, and the babe lying in the manger. ",selected_bible_verses
1718,"And having seen it, they made known abroad the saying which was told them concerning this child. ",selected_bible_verses
1719,And all that heard wondered at the things which were told them by the shepherds. ,selected_bible_verses
1720,"And the shepherds returned, glorifying and praising God for all that they heard and saw, as it was told to them.  ",selected_bible_verses
1721,"And when eight days were completed for circumcising him, his name was called Jesus; the name given by the angel before he was conceived in the womb.  ",selected_bible_verses
1722,"And when the days of their purification, according to the law of Moses, were completed, they brought him up to Jerusalem, to present him to the Lord, ",selected_bible_verses
1723,(as it is written in the law of the Lord: Every male that opens the womb shall be called holy to the Lord;) ,selected_bible_verses
1724,"and to offer a sacrifice according to what is said in the law of the Lord: A pair of turtle-doves, or two young pigeons.  ",selected_bible_verses
1725,"And, behold, there was a man in Jerusalem, whose name was Simeon; and this man was just and devout, waiting for the consolation of Israel; and the Holy Spirit was upon him, ",selected_bible_verses
1726,"And it was revealed to him by the Holy Spirit, that he should not see death, before he had seen the Christ of the Lord. ",selected_bible_verses
1727,"And he came by the Spirit into the temple; and when the parents brought in the child Jesus, to do for him after the custom of the law, ",selected_bible_verses
1728,"then he took him into his arms, and blessed God, and said: ",selected_bible_verses
1729,"Now, Lord, thou lettest thy servant depart in peace, according to thy word; ",selected_bible_verses
1730,"because my eyes saw thy salvation, ",selected_bible_verses
1731,"which thou preparedst before the face of all the peoples, ",selected_bible_verses
1732,"a light for a revelation to the Gentiles, and the glory of thy people Israel.  ",selected_bible_verses
1733,And his father and mother wondered at the things spoken of him. ,selected_bible_verses
1734,"And Simeon blessed them, and said to Mary his mother: Behold, this child is set for the fall and rising of many in Israel, and for a sign that shall be spoken against, ",selected_bible_verses
1735,"(and a sword shall pierce through thine own soul also), that thoughts from many hearts may be revealed.  ",selected_bible_verses
1736,"And there was Anna, a prophetess, daughter of Phanuel, of the tribe of Asher. She was of great age, and had lived with a husband seven years from her virginity; ",selected_bible_verses
1737,"and she was a widow of about fourscore and four years, who departed not from the temple, serving day and night with fastings and prayers. ",selected_bible_verses
1738,"And she, coming up at that very time, likewise gave thanks to the Lord, and spoke of him to all that were looking for the redemption of Jerusalem.  ",selected_bible_verses
1739,"And when they had performed all things according to the law of the Lord, they returned into Galilee, to their own city Nazareth. ",selected_bible_verses
1740,"And the child grew, and became strong, being filled with wisdom; and the favor of God was upon him.  ",selected_bible_verses
1741,And his parents went to Jerusalem every year at the feast of the passover. ,selected_bible_verses
1742,"And when he was twelve years old, they having gone up according to the custom of the feast, ",selected_bible_verses
1743,"and completed the days, as they returned, Jesus the child remained behind in Jerusalem. And his parents knew it not, ",selected_bible_verses
1744,"but supposing that he was in the company, went a day's journey, and sought him among their kindred and acquaintance; ",selected_bible_verses
1745,"and not finding him, they returned to Jerusalem, seeking him.  ",selected_bible_verses
1746,"And it came to pass, that after three days they found him in the temple, sitting in the midst of the teachers, both hearing them, and asking them questions. ",selected_bible_verses
1747,"And all that heard him, were astonished at his understanding and answers. ",selected_bible_verses
1748,"And seeing him they were amazed. And his mother said to him: Child, why didst thou thus deal with us? Behold, thy father and I sought thee, sorrowing. ",selected_bible_verses
1749,And they understood not the saying which he spoke to them.  ,selected_bible_verses
1750,"And he went down with them, and came to Nazareth, and was subject to them. And his mother kept all these sayings in her heart.  ",selected_bible_verses
1751,"And Jesus increased in wisdom and stature, and in favor with God and men.    III.  NOW in the fifteenth year of the reign of Tiberius Caesar, when Pontius Pilate was governor of Judaea, and Herod tetrarch of Galilee, and his brother Philip tetrarch, of Iturea and of the region of Trachonitis, and Lysanias tetrarch of Abilene, ",selected_bible_verses
1752,"when Annas was high priest and Caiaphas, the word of God came to John, the son of Zachariah, in the wilderness. ",selected_bible_verses
1753,"And he came into all the country about the Jordan, preaching the immersion of repentance, unto remission of sins, ",selected_bible_verses
1754,"as it is written in the book of the words of Isaiah the prophet:      The voice of one crying in the wilderness,     Prepare the way of the Lord,     Make straight his paths.     ",selected_bible_verses
1755,"Every valley shall be filled,     And every mountain and hill shall be brought low;     And the crooked shall be straight,     And the rough ways smooth;     ",selected_bible_verses
1756,And all flesh shall see the salvation of God.  ,selected_bible_verses
1757,"He said therefore to the multitudes that came out to be immersed by him: Brood of vipers, who warned you to flee from the coming wrath? ",selected_bible_verses
1758,"Bring forth therefore fruits worthy of repentance; and begin not to say within yourselves, We have Abraham for our father; for I say to you, that God is able of these stones to raise up children to Abraham. ",selected_bible_verses
1759,"And now also the axe is laid to the root of the trees. Every tree therefore, that brings not forth good fruit, is cut down and cast into the fire.  ",selected_bible_verses
1760,"And the multitudes asked him, saying: What then shall we do? ",selected_bible_verses
1761,"He answering says to them: He that has two coats, let him impart to him that has none; and he that has food, let him do likewise.  ",selected_bible_verses
1762,"And there came also publicans to be immersed; and they said to him: Teacher, what shall we do? ",selected_bible_verses
1763,And he said to them: Exact no more than that which is appointed you. ,selected_bible_verses
1764,"And while the people were in expectation, and all were reasoning in their hearts concerning John, whether he himself were not the Christ, ",selected_bible_verses
1765,"John answered them all, saying: I indeed immerse you in water; but there comes he that is mightier than I, the latchet of whose sandals I am not worthy to loose; he will immerse you in the Holy Spirit and fire; ",selected_bible_verses
1766,"whose fan is in his hand, and he will thoroughly cleanse his threshing-floor, and will gather the wheat into his garner; but the chaff he will burn up with fire unquenchable.  ",selected_bible_verses
1767,And with many other exhortations he published the good tidings to the people.  ,selected_bible_verses
1768,"But Herod the tetrarch, being reproved by him on account of Herodias, the wife of his brother, and for all the evils which Herod did, ",selected_bible_verses
1769,"added to all this also, that he shut up John in prison.  ",selected_bible_verses
1770,"Now it came to pass, when all the people had been immersed, that as Jesus, having also been immersed, was praying, the heaven was opened, ",selected_bible_verses
1771,and the Holy Spirit descended in a bodily shape as a dove upon him; and there came a voice out of heaven: Thou art my beloved Son; in thee I am well pleased.  ,selected_bible_verses
1772,"the son of Matthat, the son of Levi, the son of Melchi, the son of Janna, the son of Joseph, ",selected_bible_verses
1773,"the son of Matthias, the son of Amos, the son of Nahum, the son of Esli, the son of Naggai, ",selected_bible_verses
1774,"the son of Maath, the son of Mattathias, the son of Shimei, the son of Joseph, the son of Judah, ",selected_bible_verses
1775,"the son of Joanna, the son of Reza, the son of Zerubbabel, the son of Salathiel, the son of Neri, ",selected_bible_verses
1776,"the son of Melchi, the son of Addi, the son of Cosam, the son of Elmodam, the son of Er, ",selected_bible_verses
1777,"the son of Joses, the son of Eliezer, the son of Jorim, the son of Matthat, the son of Levi, ",selected_bible_verses
1778,"the son of Simeon, the son of Judah, the son of Joseph, the son of Jonan, the son of Eliakim, ",selected_bible_verses
1779,"the son of Meleah, the son of Mainan, the son of Mattatha, the son of Nathan, the son of David, ",selected_bible_verses
1780,"the son of Jesse, the son of Obed, the son of Boaz, the son of Salmon, the son of Nahon, ",selected_bible_verses
1781,"the son of Amminadab, the son of Ram, the son of Hezron, the son of Pharez, the son of Judah, ",selected_bible_verses
1782,"the son of Jacob, the son of Isaac, the son of Abraham, the son of Terah, the son of Nahor, ",selected_bible_verses
1783,"the son of Serug, the son of Reu, the son of Peleg, the son of Eber, the son of Salah, ",selected_bible_verses
1784,"the son of Cainan, the son of Arphaxad, the son of Shem, the son of Noah, the son of Lamech, ",selected_bible_verses
1785,"the son of Methuselah, the son of Enoch, the son of Jared, the son of Mehalaleel, the son of Cainan, ",selected_bible_verses
1786,"the son of Enos, the son of Seth, the son of Adam, the son of God.    IV.  AND Jesus, full of the Holy Spirit, returned from the Jordan; and he was led in the Sprit into the wilderness ",selected_bible_verses
1787,"forty days, tempted by the Devil. And he ate nothing in those days; and when they were ended, he hungered.  ",selected_bible_verses
1788,"And the Devil said to him: If thou art the Son of God, command this stone that it become bread. ",selected_bible_verses
1789,"And Jesus answered him, saying: It is written, Man shall not live on bread alone.  ",selected_bible_verses
1790,"And the Devil, leading him up into a high mountain, showed him all the kingdoms of the world in a moment of time. ",selected_bible_verses
1791,"And the Devil said to him: All this power will I give thee, and the glory of them; because it has been delivered to me, and I give it to whomsoever I will. ",selected_bible_verses
1792,"If thou therefore wilt worship me, all shall be thine. ",selected_bible_verses
1793,"And Jesus answering said to him: It is written, Thou shalt worship the Lord thy God, and him only shalt thou serve.  ",selected_bible_verses
1794,"And he brought him to Jerusalem, and set him on the pinnacle of the temple, and said to him: If thou art the Son of God, cast thyself down from hence. ",selected_bible_verses
1795,"For it is written: He will give his angels command concerning thee, to keep thee; ",selected_bible_verses
1796,"and on their hands they shall bear thee up, lest haply thou dash thy foot against a stone. ",selected_bible_verses
1797,"And Jesus answering said to him: It is said, Thou shalt not tempt the Lord thy God.  ",selected_bible_verses
1798,"And having finished every temptation, the Devil departed from him for a season.  ",selected_bible_verses
1799,And Jesus returned in the power of the Spirit into Galilee; and there went out a report concerning him through all the surrounding country. ,selected_bible_verses
1800,"And he taught in their synagogues, being honored by all.  ",selected_bible_verses
1801,"And he came to Nazareth, where he had been brought up. And, as his custom was, he went into the synagogue on the sabbath day; and he stood up to read. ",selected_bible_verses
1802,"And there was delivered to him the book of the prophet Isaiah. And unrolling the book, he found the place where it was written:      ",selected_bible_verses
1803,"The Spirit of the Lord is upon me;     Because he anointed me to publish good tidings to the poor;     He has sent me to proclaim deliverance to the captives,     And recovering of sight to the blind,     To send the oppressed away free,     ",selected_bible_verses
1804,To proclaim the acceptable year of the Lord.  ,selected_bible_verses
1805,"And rolling up the book he gave it again to the servant, and sat down. And the eyes of all in the synagogue were fastened on him. ",selected_bible_verses
1806,And he began to say to them: To-day is this scripture fulfilled in your ears. ,selected_bible_verses
1807,"And all bore witness to him, and wondered at the words of grace which proceeded out of his mouth. And they said: Is not this Joseph's son? ",selected_bible_verses
1808,"And he said to them: Ye will surely say to me this proverb, Physician, heal thyself. Whatever we heard done in Capernaum, do also here in thy country. ",selected_bible_verses
1809,"And he said: Verily I say to you, no prophet is accepted in his own country. ",selected_bible_verses
1810,"But I tell you of a truth, there were many widows in Israel in the days of Elijah, when the heaven was shut up three years and six months, when there was a great famine throughout all the land; ",selected_bible_verses
