,text,type
108,"for truly in this city there were gathered together against thy holy servant Jesus, whom thou didst anoint, both Herod and Pontius Pilate, with the Gentiles and the peoples of Israel,",acts
109,to do whatever thy hand and thy plan had predestined to take place.,acts
110,"And now, Lord, look upon their threats, and grant to thy servants to speak thy word with all boldness,",acts
111,"while thou stretchest out thy hand to heal, and signs and wonders are performed through the name of thy holy servant Jesus.""",acts
112,"And when they had prayed, the place in which they were gathered together was shaken; and they were all filled with the Holy Spirit and spoke the word of God with boldness.",acts
113,"And with great power the apostles gave their testimony to the resurrection of the Lord Jesus, and great grace was upon them all.",acts
114,"There was not a needy person among them, for as many as were possessors of lands or houses sold them, and brought the proceeds of what was sold",acts
115,and laid it at the apostles' feet; and distribution was made to each as any had need.,acts
116,"Thus Joseph who was surnamed by the apostles Barnabas (which means, Son of encouragement), a Levite, a native of Cyprus,",acts
117,"sold a field which belonged to him, and brought the money and laid it at the apostles' feet.",acts
118,"and with his wife's knowledge he kept back some of the proceeds, and brought only a part and laid it at the apostles' feet.",acts
119,"But Peter said, ""Anani'as, why has Satan filled your heart to lie to the Holy Spirit and to keep back part of the proceeds of the land?",acts
120,"While it remained unsold, did it not remain your own? And after it was sold, was it not at your disposal? How is it that you have contrived this deed in your heart? You have not lied to men but to God.""",acts
121,"When Anani'as heard these words, he fell down and died. And great fear came upon all who heard of it.",acts
122,The young men rose and wrapped him up and carried him out and buried him.,acts
123,"And Peter said to her, ""Tell me whether you sold the land for so much."" And she said, ""Yes, for so much.""",acts
124,"But Peter said to her, ""How is it that you have agreed together to tempt the Spirit of the Lord? Hark, the feet of those that have buried your husband are at the door, and they will carry you out.""",acts
125,"Immediately she fell down at his feet and died. When the young men came in they found her dead, and they carried her out and buried her beside her husband.",acts
126,"And great fear came upon the whole church, and upon all who heard of these things.",acts
127,"None of the rest dared join them, but the people held them in high honor.",acts
128,"And more than ever believers were added to the Lord, multitudes both of men and women,",acts
129,"so that they even carried out the sick into the streets, and laid them on beds and pallets, that as Peter came by at least his shadow might fall on some of them.",acts
130,"The people also gathered from the towns around Jerusalem, bringing the sick and those afflicted with unclean spirits, and they were all healed.",acts
131,they arrested the apostles and put them in the common prison.,acts
132,"But at night an angel of the Lord opened the prison doors and brought them out and said,",acts
133,"""Go and stand in the temple and speak to the people all the words of this Life.""",acts
134,"And when they heard this, they entered the temple at daybreak and taught.",acts
135,"But when the officers came, they did not find them in the prison, and they returned and reported,",acts
136,"""We found the prison securely locked and the sentries standing at the doors, but when we opened it we found no one inside.""",acts
137,"Now when the captain of the temple and the chief priests heard these words, they were much perplexed about them, wondering what this would come to.",acts
138,"And some one came and told them, ""The men whom you put in prison are standing in the temple and teaching the people.""",acts
139,"Then the captain with the officers went and brought them, but without violence, for they were afraid of being stoned by the people.",acts
140,"saying, ""We strictly charged you not to teach in this name, yet here you have filled Jerusalem with your teaching and you intend to bring this man's blood upon us.""",acts
141,"But Peter and the apostles answered, ""We must obey God rather than men.",acts
142,The God of our fathers raised Jesus whom you killed by hanging him on a tree.,acts
143,"God exalted him at his right hand as Leader and Savior, to give repentance to Israel and forgiveness of sins.",acts
144,"And we are witnesses to these things, and so is the Holy Spirit whom God has given to those who obey him.""",acts
145,"But a Pharisee in the council named Gama'li-el, a teacher of the law, held in honor by all the people, stood up and ordered the men to be put outside for a while.",acts
146,"And he said to them, ""Men of Israel, take care what you do with these men.",acts
147,"For before these days Theu'das arose, giving himself out to be somebody, and a number of men, about four hundred, joined him; but he was slain and all who followed him were dispersed and came to nothing.",acts
148,"After him Judas the Galilean arose in the days of the census and drew away some of the people after him; he also perished, and all who followed him were scattered.",acts
149,"So in the present case I tell you, keep away from these men and let them alone; for if this plan or this undertaking is of men, it will fail;",acts
150,"but if it is of God, you will not be able to overthrow them. You might even be found opposing God!""",acts
151,"Then they left the presence of the council, rejoicing that they were counted worthy to suffer dishonor for the name.",acts
152,And every day in the temple and at home they did not cease teaching and preaching Jesus as the Christ.,acts
153,"And the twelve summoned the body of the disciples and said, ""It is not right that we should give up preaching the word of God to serve tables.",acts
154,"Therefore, brethren, pick out from among you seven men of good repute, full of the Spirit and of wisdom, whom we may appoint to this duty.",acts
155,"But we will devote ourselves to prayer and to the ministry of the word.""",acts
156,"And what they said pleased the whole multitude, and they chose Stephen, a man full of faith and of the Holy Spirit, and Philip, and Proch'orus, and Nica'nor, and Ti'mon, and Par'menas, and Nicola'us, a proselyte of Antioch.",acts
157,"These they set before the apostles, and they prayed and laid their hands upon them.",acts
158,"Then some of those who belonged to the synagogue of the Freedmen (as it was called), and of the Cyre'nians, and of the Alexandrians, and of those from Cili'cia and Asia, arose and disputed with Stephen.",acts
159,But they could not withstand the wisdom and the Spirit with which he spoke.,acts
160,"Then they secretly instigated men, who said, ""We have heard him speak blasphemous words against Moses and God.""",acts
161,"And they stirred up the people and the elders and the scribes, and they came upon him and seized him and brought him before the council,",acts
162,"and set up false witnesses who said, ""This man never ceases to speak words against this holy place and the law;",acts
163,"for we have heard him say that this Jesus of Nazareth will destroy this place, and will change the customs which Moses delivered to us.""",acts
164,"And gazing at him, all who sat in the council saw that his face was like the face of an angel.",acts
165,"And Stephen said: ""Brethren and fathers, hear me. The God of glory appeared to our father Abraham, when he was in Mesopota'mia, before he lived in Haran,",acts
166,"and said to him, `Depart from your land and from your kindred and go into the land which I will show you.'",acts
167,"Then he departed from the land of the Chalde'ans, and lived in Haran. And after his father died, God removed him from there into this land in which you are now living;",acts
168,"yet he gave him no inheritance in it, not even a foot's length, but promised to give it to him in possession and to his posterity after him, though he had no child.",acts
169,"And God spoke to this effect, that his posterity would be aliens in a land belonging to others, who would enslave them and ill-treat them four hundred years.",acts
170,"`But I will judge the nation which they serve,' said God, `and after that they shall come out and worship me in this place.'",acts
171,"And he gave him the covenant of circumcision. And so Abraham became the father of Isaac, and circumcised him on the eighth day; and Isaac became the father of Jacob, and Jacob of the twelve patriarchs.",acts
172,"and rescued him out of all his afflictions, and gave him favor and wisdom before Pharaoh, king of Egypt, who made him governor over Egypt and over all his household.",acts
173,"Now there came a famine throughout all Egypt and Canaan, and great affliction, and our fathers could find no food.",acts
174,"But when Jacob heard that there was grain in Egypt, he sent forth our fathers the first time.",acts
175,"And at the second visit Joseph made himself known to his brothers, and Joseph's family became known to Pharaoh.",acts
176,"And Joseph sent and called to him Jacob his father and all his kindred, seventy-five souls;",acts
177,"and Jacob went down into Egypt. And he died, himself and our fathers,",acts
178,and they were carried back to Shechem and laid in the tomb that Abraham had bought for a sum of silver from the sons of Hamor in Shechem.,acts
179,till there arose over Egypt another king who had not known Joseph.,acts
180,"He dealt craftily with our race and forced our fathers to expose their infants, that they might not be kept alive.",acts
181,"At this time Moses was born, and was beautiful before God. And he was brought up for three months in his father's house;",acts
182,"and when he was exposed, Pharaoh's daughter adopted him and brought him up as her own son.",acts
183,"And Moses was instructed in all the wisdom of the Egyptians, and he was mighty in his words and deeds.",acts
184,"And seeing one of them being wronged, he defended the oppressed man and avenged him by striking the Egyptian.",acts
185,"He supposed that his brethren understood that God was giving them deliverance by his hand, but they did not understand.",acts
186,"And on the following day he appeared to them as they were quarreling and would have reconciled them, saying, `Men, you are brethren, why do you wrong each other?'",acts
187,"But the man who was wronging his neighbor thrust him aside, saying, `Who made you a ruler and a judge over us?",acts
188,Do you want to kill me as you killed the Egyptian yesterday?',acts
189,"At this retort Moses fled, and became an exile in the land of Mid'ian, where he became the father of two sons.",acts
190,"When Moses saw it he wondered at the sight; and as he drew near to look, the voice of the Lord came,",acts
191,"`I am the God of your fathers, the God of Abraham and of Isaac and of Jacob.' And Moses trembled and did not dare to look.",acts
192,"And the Lord said to him, `Take off the shoes from your feet, for the place where you are standing is holy ground.",acts
193,"I have surely seen the ill-treatment of my people that are in Egypt and heard their groaning, and I have come down to deliver them. And now come, I will send you to Egypt.'",acts
194,"He led them out, having performed wonders and signs in Egypt and at the Red Sea, and in the wilderness for forty years.",acts
195,"This is the Moses who said to the Israelites, `God will raise up for you a prophet from your brethren as he raised me up.'",acts
196,"This is he who was in the congregation in the wilderness with the angel who spoke to him at Mount Sinai, and with our fathers; and he received living oracles to give to us.",acts
197,"Our fathers refused to obey him, but thrust him aside, and in their hearts they turned to Egypt,",acts
198,"saying to Aaron, `Make for us gods to go before us; as for this Moses who led us out from the land of Egypt, we do not know what has become of him.'",acts
199,"And they made a calf in those days, and offered a sacrifice to the idol and rejoiced in the works of their hands.",acts
200,"But God turned and gave them over to worship the host of heaven, as it is written in the book of the prophets: `Did you offer to me slain beasts and sacrifices,",acts
201,"And you took up the tent of Moloch,",acts
202,"Our fathers in turn brought it in with Joshua when they dispossessed the nations which God thrust out before our fathers. So it was until the days of David,",acts
203,who found favor in the sight of God and asked leave to find a habitation for the God of Jacob.,acts
204,But it was Solomon who built a house for him.,acts
205,"Yet the Most High does not dwell in houses made with hands; as the prophet says,",acts
206,"`Heaven is my throne,",acts
207,Did not my hand make all these things?',acts
208,"Which of the prophets did not your fathers persecute? And they killed those who announced beforehand the coming of the Righteous One, whom you have now betrayed and murdered,",acts
209,"you who received the law as delivered by angels and did not keep it.""",acts
210,"But he, full of the Holy Spirit, gazed into heaven and saw the glory of God, and Jesus standing at the right hand of God;",acts
211,"and he said, ""Behold, I see the heavens opened, and the Son of man standing at the right hand of God.""",acts
212,But they cried out with a loud voice and stopped their ears and rushed together upon him.,acts
213,Then they cast him out of the city and stoned him; and the witnesses laid down their garments at the feet of a young man named Saul.,acts
214,"And as they were stoning Stephen, he prayed, ""Lord Jesus, receive my spirit.""",acts
215,"And he knelt down and cried with a loud voice, ""Lord, do not hold this sin against them."" And when he had said this, he fell asleep.",acts
216,"Devout men buried Stephen, and made great lamentation over him.",acts
217,"But Saul was ravaging the church, and entering house after house, he dragged off men and women and committed them to prison.",acts
218,"Philip went down to a city of Sama'ria, and proclaimed to them the Christ.",acts
219,"And the multitudes with one accord gave heed to what was said by Philip, when they heard him and saw the signs which he did.",acts
220,"For unclean spirits came out of many who were possessed, crying with a loud voice; and many who were paralyzed or lame were healed.",acts
221,So there was much joy in that city.,acts
222,"They all gave heed to him, from the least to the greatest, saying, ""This man is that power of God which is called Great.""",acts
223,"And they gave heed to him, because for a long time he had amazed them with his magic.",acts
224,"But when they believed Philip as he preached good news about the kingdom of God and the name of Jesus Christ, they were baptized, both men and women.",acts
225,"Even Simon himself believed, and after being baptized he continued with Philip. And seeing signs and great miracles performed, he was amazed.",acts
226,who came down and prayed for them that they might receive the Holy Spirit;,acts
227,"for it had not yet fallen on any of them, but they had only been baptized in the name of the Lord Jesus.",acts
228,Then they laid their hands on them and they received the Holy Spirit.,acts
229,"Now when Simon saw that the Spirit was given through the laying on of the apostles' hands, he offered them money,",acts
230,"saying, ""Give me also this power, that any one on whom I lay my hands may receive the Holy Spirit.""",acts
231,"But Peter said to him, ""Your silver perish with you, because you thought you could obtain the gift of God with money!",acts
232,"You have neither part nor lot in this matter, for your heart is not right before God.",acts
233,"Repent therefore of this wickedness of yours, and pray to the Lord that, if possible, the intent of your heart may be forgiven you.",acts
234,"For I see that you are in the gall of bitterness and in the bond of iniquity.""",acts
235,"And Simon answered, ""Pray for me to the Lord, that nothing of what you have said may come upon me.""",acts
236,"And he rose and went. And behold, an Ethiopian, a eunuch, a minister of the Can'dace, queen of the Ethiopians, in charge of all her treasure, had come to Jerusalem to worship",acts
237,"and was returning; seated in his chariot, he was reading the prophet Isaiah.",acts
238,"And the Spirit said to Philip, ""Go up and join this chariot.""",acts
239,"So Philip ran to him, and heard him reading Isaiah the prophet, and asked, ""Do you understand what you are reading?""",acts
240,"And he said, ""How can I, unless some one guides me?"" And he invited Philip to come up and sit with him.",acts
241,"Now the passage of the scripture which he was reading was this: ""As a sheep led to the slaughter",acts
242,In his humiliation justice was denied him.,acts
243,"And the eunuch said to Philip, ""About whom, pray, does the prophet say this, about himself or about some one else?""",acts
244,"Then Philip opened his mouth, and beginning with this scripture he told him the good news of Jesus.",acts
245,"And as they went along the road they came to some water, and the eunuch said, ""See, here is water! What is to prevent my being baptized?""",acts
246,"And he commanded the chariot to stop, and they both went down into the water, Philip and the eunuch, and he baptized him.",acts
247,"And when they came up out of the water, the Spirit of the Lord caught up Philip; and the eunuch saw him no more, and went on his way rejoicing.",acts
248,"But Philip was found at Azo'tus, and passing on he preached the gospel to all the towns till he came to Caesare'a.",acts
249,"and asked him for letters to the synagogues at Damascus, so that if he found any belonging to the Way, men or women, he might bring them bound to Jerusalem.",acts
250,"Now as he journeyed he approached Damascus, and suddenly a light from heaven flashed about him.",acts
251,"And he fell to the ground and heard a voice saying to him, ""Saul, Saul, why do you persecute me?""",acts
252,"And he said, ""Who are you, Lord?"" And he said, ""I am Jesus, whom you are persecuting;",acts
253,"but rise and enter the city, and you will be told what you are to do.""",acts
254,"The men who were traveling with him stood speechless, hearing the voice but seeing no one.",acts
255,"Saul arose from the ground; and when his eyes were opened, he could see nothing; so they led him by the hand and brought him into Damascus.",acts
256,"And for three days he was without sight, and neither ate nor drank.",acts
257,"And the Lord said to him, ""Rise and go to the street called Straight, and inquire in the house of Judas for a man of Tarsus named Saul; for behold, he is praying,",acts
258,"and he has seen a man named Anani'as come in and lay his hands on him so that he might regain his sight.""",acts
259,"But Anani'as answered, ""Lord, I have heard from many about this man, how much evil he has done to thy saints at Jerusalem;",acts
260,"and here he has authority from the chief priests to bind all who call upon thy name.""",acts
261,"But the Lord said to him, ""Go, for he is a chosen instrument of mine to carry my name before the Gentiles and kings and the sons of Israel;",acts
262,"for I will show him how much he must suffer for the sake of my name.""",acts
263,"So Anani'as departed and entered the house. And laying his hands on him he said, ""Brother Saul, the Lord Jesus who appeared to you on the road by which you came, has sent me that you may regain your sight and be filled with the Holy Spirit.""",acts
264,"And immediately something like scales fell from his eyes and he regained his sight. Then he rose and was baptized,",acts
265,and took food and was strengthened.,acts
266,"And in the synagogues immediately he proclaimed Jesus, saying, ""He is the Son of God.""",acts
267,"And all who heard him were amazed, and said, ""Is not this the man who made havoc in Jerusalem of those who called on this name? And he has come here for this purpose, to bring them bound before the chief priests.""",acts
268,"But Saul increased all the more in strength, and confounded the Jews who lived in Damascus by proving that Jesus was the Christ.",acts
269,"but their plot became known to Saul. They were watching the gates day and night, to kill him;",acts
270,"but his disciples took him by night and let him down over the wall, lowering him in a basket.",acts
271,"But Barnabas took him, and brought him to the apostles, and declared to them how on the road he had seen the Lord, who spoke to him, and how at Damascus he had preached boldly in the name of Jesus.",acts
272,"So he went in and out among them at Jerusalem,",acts
273,preaching boldly in the name of the Lord. And he spoke and disputed against the Hellenists; but they were seeking to kill him.,acts
274,"And when the brethren knew it, they brought him down to Caesare'a, and sent him off to Tarsus.",acts
275,"There he found a man named Aene'as, who had been bedridden for eight years and was paralyzed.",acts
276,"And Peter said to him, ""Aene'as, Jesus Christ heals you; rise and make your bed."" And immediately he rose.",acts
277,"And all the residents of Lydda and Sharon saw him, and they turned to the Lord.",acts
278,"In those days she fell sick and died; and when they had washed her, they laid her in an upper room.",acts
279,"Since Lydda was near Joppa, the disciples, hearing that Peter was there, sent two men to him entreating him, ""Please come to us without delay.""",acts
280,"So Peter rose and went with them. And when he had come, they took him to the upper room. All the widows stood beside him weeping, and showing tunics and other garments which Dorcas made while she was with them.",acts
281,"But Peter put them all outside and knelt down and prayed; then turning to the body he said, ""Tabitha, rise."" And she opened her eyes, and when she saw Peter she sat up.",acts
282,And he gave her his hand and lifted her up. Then calling the saints and widows he presented her alive.,acts
283,"And it became known throughout all Joppa, and many believed in the Lord.",acts
284,"And he stayed in Joppa for many days with one Simon, a tanner.",acts
285,"a devout man who feared God with all his household, gave alms liberally to the people, and prayed constantly to God.",acts
286,"About the ninth hour of the day he saw clearly in a vision an angel of God coming in and saying to him, ""Cornelius.""",acts
287,"And he stared at him in terror, and said, ""What is it, Lord?"" And he said to him, ""Your prayers and your alms have ascended as a memorial before God.",acts
288,"And now send men to Joppa, and bring one Simon who is called Peter;",acts
289,"he is lodging with Simon, a tanner, whose house is by the seaside.""",acts
290,"When the angel who spoke to him had departed, he called two of his servants and a devout soldier from among those that waited on him,",acts
291,"and having related everything to them, he sent them to Joppa.",acts
292,"And he became hungry and desired something to eat; but while they were preparing it, he fell into a trance",acts
293,"and saw the heaven opened, and something descending, like a great sheet, let down by four corners upon the earth.",acts
294,In it were all kinds of animals and reptiles and birds of the air.,acts
295,"And there came a voice to him, ""Rise, Peter; kill and eat.""",acts
296,"But Peter said, ""No, Lord; for I have never eaten anything that is common or unclean.""",acts
297,"And the voice came to him again a second time, ""What God has cleansed, you must not call common.""",acts
298,"This happened three times, and the thing was taken up at once to heaven.",acts
299,and called out to ask whether Simon who was called Peter was lodging there.,acts
300,"And while Peter was pondering the vision, the Spirit said to him, ""Behold, three men are looking for you.",acts
301,"Rise and go down, and accompany them without hesitation; for I have sent them.""",acts
302,"And Peter went down to the men and said, ""I am the one you are looking for; what is the reason for your coming?""",acts
303,"And they said, ""Cornelius, a centurion, an upright and God-fearing man, who is well spoken of by the whole Jewish nation, was directed by a holy angel to send for you to come to his house, and to hear what you have to say.""",acts
304,So he called them in to be his guests.,acts
305,And on the following day they entered Caesare'a. Cornelius was expecting them and had called together his kinsmen and close friends.,acts
306,"When Peter entered, Cornelius met him and fell down at his feet and worshiped him.",acts
307,"But Peter lifted him up, saying, ""Stand up; I too am a man.""",acts
308,"And as he talked with him, he went in and found many persons gathered;",acts
309,"and he said to them, ""You yourselves know how unlawful it is for a Jew to associate with or to visit any one of another nation; but God has shown me that I should not call any man common or unclean.",acts
310,"So when I was sent for, I came without objection. I ask then why you sent for me.""",acts
311,"saying, `Cornelius, your prayer has been heard and your alms have been remembered before God.",acts
312,"Send therefore to Joppa and ask for Simon who is called Peter; he is lodging in the house of Simon, a tanner, by the seaside.'",acts
313,"So I sent to you at once, and you have been kind enough to come. Now therefore we are all here present in the sight of God, to hear all that you have been commanded by the Lord.""",acts
314,but in every nation any one who fears him and does what is right is acceptable to him.,acts
315,"You know the word which he sent to Israel, preaching good news of peace by Jesus Christ (he is Lord of all),",acts
